{
  "$schema": "https://json-schema.org/draft/2020-12/schema",
  "$id": "https://open-autoresearch/schema/experiment_record.schema.json",
  "title": "Experiment Record (PROTOCOL.md §14.1, Protocol 0.6 sharded ledger)",
  "description": "One immutable JSON file per experiment at state/ledger/<id>.json. A correction is a NEW record referencing the prior id in parent_ids; records are never mutated. additionalProperties is intentionally true: consumers (e.g. ActivityEncoder) carry additive fields like maturity_level, not_deployable, artifacts.mlflow, factorial_cells, and schema-validity is necessary but not sufficient for verifier-completeness.",
  "type": "object",
  "additionalProperties": true,
  "required": [
    "protocol_version",
    "id",
    "timestamp",
    "branch",
    "hypothesis",
    "parent_ids",
    "status",
    "metrics"
  ],
  "anyOf": [
    {
      "description": "New (Level-1 content-addressed) provenance shape — the full triple, so the visible reachability bit is never silently dropped.",
      "required": ["source_commit", "source_branch", "resolvable_from_main"]
    },
    {
      "description": "Legacy/pre-redesign shape (deprecated; back-compat only).",
      "required": ["git_sha_before", "git_sha_after"]
    }
  ],
  "properties": {
    "protocol_version": {
      "type": "string",
      "enum": ["0.5", "0.6"],
      "description": "Protocol version stamp. Current writers MUST emit \"0.6\"; \"0.5\" remains accepted for existing sharded-ledger records."
    },
    "id": {
      "type": "string",
      "description": "YYYYMMDD-HHMMSS-<6hex>[-<slug>]; unique per record and the ledger filename stem.",
      "pattern": "^[0-9]{8}-[0-9]{6}-[0-9a-f]{6}(-[a-z0-9-]+)?$"
    },
    "timestamp": {
      "type": "string",
      "description": "ISO-8601 UTC timestamp of record creation."
    },
    "branch": {
      "type": "string",
      "description": "Research branch / experiment lineage label."
    },
    "hypothesis": {
      "type": "string",
      "description": "What this experiment tests."
    },
    "parent_ids": {
      "type": "array",
      "description": "ids of parent records, or empty for a root. The sentinel \"baseline\" is also accepted by validate_ledger.py.",
      "items": {
        "type": "string"
      }
    },
    "status": {
      "type": "string",
      "description": "Free-form status label (e.g. baseline, promising, branch_winner, failed, infra_failed, budget_truncated, invalid, invalidated, informative_failure, rejected)."
    },
    "failure_reason": {
      "type": "string",
      "minLength": 1,
      "description": "Required by the reference validator when status is infra_failed or budget_truncated; recommended for invalid."
    },
    "coordinator_executor_separation": {
      "type": "string",
      "enum": ["level_0", "level_1", "level_2", "level_3"],
      "description": "Optional §5.8 achieved separation level for Research Director / Implementation Worker handoff evidence."
    },
    "lifecycle_status": {
      "type": "string",
      "enum": ["proposed", "pending", "running", "completed", "merged", "pruned", "blocked"],
      "description": "OPTIONAL tree lifecycle state for derived research_tree views. Distinct from evidence/promotion labels in status/promotion_status."
    },
    "promotion_status": {
      "type": "string",
      "enum": ["none", "promising", "level1_branch_winner", "level2_branch_winner", "branch_winner", "promotion_candidate", "promoted", "low_evidence_promoted", "rejected"],
      "description": "OPTIONAL promotion/evidence label used by derived tree views. Existing status labels keep their protocol meaning; this field separates promotion posture from lifecycle state."
    },
    "frontier_eligible": {
      "type": "boolean",
      "description": "OPTIONAL override for whether this node belongs in the derived active frontier view. When omitted, regenerate_state.py derives frontier eligibility from lifecycle_status."
    },
    "blocked_by": {
      "type": "array",
      "description": "OPTIONAL blockers for lifecycle_status=blocked. Values may be record ids, issue ids, or human-decision markers.",
      "items": {
        "type": "string",
        "minLength": 1
      }
    },
    "pruned_reason": {
      "type": "string",
      "minLength": 1,
      "description": "OPTIONAL short reason when lifecycle_status=pruned."
    },
    "merged_into": {
      "type": "string",
      "minLength": 1,
      "description": "OPTIONAL target record id when lifecycle_status=merged."
    },
    "node_type": {
      "type": "string",
      "enum": ["baseline", "candidate", "ablation", "verifier", "admin", "counter_example"],
      "description": "OPTIONAL tree node kind for derived research_tree views."
    },
    "branch_insights": {
      "type": "array",
      "description": "OPTIONAL propagated branch insights. Unlike local lessons[], these are compact, ledger-traceable observations meant to update ancestor constraints or future branch choices.",
      "items": {
        "type": "object",
        "additionalProperties": true,
        "required": [
          "raw_observation",
          "distilled_insight",
          "source_record_ids",
          "updates_parent_ids",
          "confidence"
        ],
        "properties": {
          "raw_observation": {
            "type": "string",
            "minLength": 1,
            "description": "Measured result, failure, or event observed in the run."
          },
          "distilled_insight": {
            "type": "string",
            "minLength": 1,
            "description": "Short interpretation of why the observation matters for the branch."
          },
          "source_record_ids": {
            "type": "array",
            "minItems": 1,
            "description": "Immutable ledger ids that support this insight.",
            "items": {
              "type": "string",
              "minLength": 1
            }
          },
          "updates_parent_ids": {
            "type": "array",
            "minItems": 1,
            "description": "Ancestor/root node ids whose future constraints or choices this insight updates. The baseline sentinel may be used for root-level constraints.",
            "items": {
              "type": "string",
              "minLength": 1
            }
          },
          "validated_constraint": {
            "type": "string",
            "minLength": 1,
            "description": "Future proposal constraint inferred from the evidence."
          },
          "invalidated_ideas": {
            "type": "array",
            "minItems": 1,
            "description": "Sibling ideas, mechanisms, or proposal shapes no longer worth pursuing without new evidence.",
            "items": {
              "type": "string",
              "minLength": 1
            }
          },
          "confidence": {
            "type": "string",
            "enum": ["low", "medium", "high"],
            "description": "Confidence in this propagated insight based on evidence quality and maturity level."
          },
          "retirement_signal": {
            "type": "string",
            "minLength": 1,
            "description": "Condition that should trigger reconsidering this insight."
          },
          "review_status": {
            "type": "string",
            "enum": ["draft", "reviewed", "contested", "rejected"],
            "description": "Whether Skeptic, human, or another review path has challenged or accepted the insight."
          },
          "review_record_ids": {
            "type": "array",
            "minItems": 1,
            "description": "Optional ledger ids or review-bearing records that reviewed or challenged the insight.",
            "items": {
              "type": "string",
              "minLength": 1
            }
          }
        }
      }
    },
    "source_commit": {
      "type": "string",
      "description": "Content-addressed-provenance Level-1 breadcrumb: the commit HEAD pointed at when this experiment ran. NON-AUTHORITATIVE — a hint, not a reproducibility guarantee. Off-main experiment branches and squash-merges mean it may never resolve from main; see resolvable_from_main. Auditability is carried by the structured record (hypothesis/params/metrics/lineage), not by this pointer. See docs/proposals/2026-06-13-provenance-redesign.md."
    },
    "source_branch": {
      "type": "string",
      "description": "The git branch the experiment ran on (e.g. an off-main campaign branch). Records where source_commit lived when captured."
    },
    "resolvable_from_main": {
      "type": "boolean",
      "description": "True only if source_commit is an ancestor of main. False for off-main/ephemeral-branch experiments; makes the (un)auditability of the commit pointer VISIBLE rather than an implied promise."
    },
    "git_sha_before": {
      "type": "string",
      "description": "DEPRECATED (Protocol 0.5 -> content-addressed provenance). Superseded by source_commit + resolvable_from_main. Accepted for back-compat with pre-existing records; new records MUST NOT emit it."
    },
    "git_sha_after": {
      "type": "string",
      "description": "DEPRECATED. See git_sha_before."
    },
    "metrics": {
      "type": "object",
      "description": "Measured metrics for this run; may be empty for preflight/admin records.",
      "additionalProperties": true
    },
    "data_snapshot": {
      "type": ["string", "null"]
    },
    "data_fingerprint": {
      "type": "object",
      "description": "OPTIONAL split/dataset identity for this run (PROTOCOL.md §6.3.1, §14.1). Records WHICH split the run used so 'same comparison set' is explicit and checkable across a baseline/candidate pair (verifier rule 11_comparison_set_identity, warn-not-gate). Recommended but NOT required (back-compat: existing records stay valid) and NOT forced via anyOf. Depth is project-chosen: the strongest form carries per-split membership_sha256 (byte-level proof); a lighter form carries dataset_fingerprint + split_spec_hash + seed (assumes deterministic materialization). Either is accepted.",
      "additionalProperties": true,
      "properties": {
        "mode": {
          "type": "string",
          "description": "Which §6.3.1 split mode produced this run's data: frozen | declarative.",
          "enum": ["frozen", "declarative"]
        },
        "dataset_fingerprint": {
          "type": "object",
          "description": "Guard B fingerprint of the dataset. Identity is (source, version, date_window) — required for a comparable identity; row_count + schema_hash are optional strengtheners (omit for a growing dataset identified by date range). See split_manifest.schema.json.",
          "additionalProperties": true
        },
        "split_spec_hash": {
          "type": "string",
          "description": "Hash of the split rule/spec (and seed) used to materialize the partition. Lighter same-set proof when the materialization is deterministic."
        },
        "seed": {
          "type": "integer",
          "description": "Seed used to materialize a declarative split."
        },
        "val_set_version": {
          "type": ["integer", "string"],
          "description": "val_set_version this run evaluated against (§17.6); part of split identity."
        },
        "membership_sha256": {
          "type": "object",
          "description": "OPTIONAL strongest-tier proof: per-split sha256 over the sorted membership ids, computed at run time (byte-level 'same set' proof even without frozen files).",
          "additionalProperties": {"type": "string"}
        }
      }
    },
    "single_non_baseline_switch": {
      "type": ["string", "null"]
    },
    "guardrails": {
      "type": "object",
      "additionalProperties": true
    },
    "seed_variance": {
      "type": "object",
      "additionalProperties": true
    },
    "cost": {
      "type": "object",
      "additionalProperties": true
    },
    "evidence_level": {
      "type": "string"
    },
    "enforcement_mode": {
      "type": "string"
    },
    "scout_mode": {
      "type": "string"
    },
    "lessons": {
      "type": "array",
      "items": {
        "type": "string"
      }
    },
    "next_actions": {
      "type": "array",
      "items": {
        "type": "string"
      }
    },
    "artifacts": {
      "type": "object",
      "additionalProperties": true
    },
    "node_title": {
      "type": "string",
      "description": "OPTIONAL curated per-node title used to derive research_tree.json node content."
    },
    "node_lessons": {
      "type": "array",
      "description": "OPTIONAL curated per-node narrative lessons used to derive research_tree.json node content.",
      "items": {
        "type": "string"
      }
    },
    "maturity_level": {
      "type": "integer",
      "description": "Additive consumer field (ActivityEncoder / level3 records)."
    },
    "not_deployable": {
      "type": "boolean"
    },
    "val_queries_incurred_by_this_run": {
      "type": "integer",
      "minimum": 0,
      "description": "Primary val-exposure derivation input (PROTOCOL §17.6). Non-negative: a negative count must not cancel ledger-derived exposure in the verifier's anti-spoof sum."
    },
    "val_queries_total_at_start": {
      "type": "integer",
      "minimum": 0
    },
    "val_queries_total_at_end": {
      "type": "integer",
      "minimum": 0
    }
  }
}
