{
  "protocol_version": "0.6",
  "id": "20260518-100000-aaa001",
  "timestamp": "2026-05-18T10:00:00Z",
  "branch": "baseline",
  "hypothesis": "Establish baseline",
  "parent_ids": [],
  "source_commit": "abc111",
  "source_branch": "baseline",
  "resolvable_from_main": false,
  "data_snapshot": "data-snap-2026-05-15",
  "single_non_baseline_switch": null,
  "metrics": {
    "validation_nll": 0.847,
    "accuracy": 0.78
  },
  "guardrails": {
    "inference_latency_ms": 18.4
  },
  "seed_variance": {
    "validation_nll_seed_std": 0.011,
    "accuracy_seed_std": 0.004
  },
  "cost": {
    "gpu_hours": 2.8,
    "wall_clock_hours": 3.1,
    "llm_tokens": 42000,
    "tool_calls": 18
  },
  "status": "baseline",
  "evidence_level": "standard",
  "enforcement_mode": "none",
  "maturity_level": 1,
  "not_deployable": true,
  "scout_mode": "offline",
  "val_queries_incurred_by_this_run": 3,
  "val_queries_total_at_start": 0,
  "val_queries_total_at_end": 3,
  "artifacts": {
    "checkpoint": "checkpoints/baseline-aaa001.pt",
    "predictions": "preds/baseline-aaa001.parquet"
  },
  "lessons": [
    "Baseline calibration is poor at the tails; subgroup behavior on rare classes is the obvious target."
  ],
  "next_actions": [
    "Try loss objective adjustments",
    "Try architecture changes (attention pooling)"
  ]
}
